[
  {
    "id": "ember",
    "name": "Ember",
    "school": "fire",
    "circle": 1,
    "cost": {
      "mana": 4,
      "reagents": {
        "reagent_black_pearl": 1,
        "reagent_sulfurous_ash": 1
      }
    },
    "cast_rounds": 0,
    "range_tiles": 5,
    "effects": [
      {
        "type": "damage",
        "element": "fire",
        "base": 6,
        "variance_pct": 0.15,
        "scaling": {
          "INT": 0.1
        }
      }
    ],
    "fizzle": {
      "base": 0.08,
      "magery_factor": -0.001
    },
    "resist_check": {
      "type": "resist_spells",
      "scale": 200
    },
    "ai_tags": [
      "nuke"
    ]
  },
  {
    "id": "frost_nip",
    "name": "Frost Nip",
    "school": "cold",
    "circle": 1,
    "cost": {
      "mana": 4,
      "reagents": {
        "reagent_black_pearl": 1,
        "reagent_spiders_silk": 1
      }
    },
    "cast_rounds": 0,
    "range_tiles": 5,
    "effects": [
      {
        "type": "damage",
        "element": "cold",
        "base": 5,
        "variance_pct": 0.15,
        "scaling": {
          "INT": 0.1
        }
      },
      {
        "type": "slow",
        "move_tiles_delta": -1,
        "rounds": 1
      }
    ],
    "fizzle": {
      "base": 0.08,
      "magery_factor": -0.001
    },
    "resist_check": {
      "type": "resist_spells",
      "scale": 200
    },
    "ai_tags": [
      "control",
      "nuke"
    ]
  },
  {
    "id": "spark",
    "name": "Spark",
    "school": "energy",
    "circle": 1,
    "cost": {
      "mana": 4,
      "reagents": {
        "reagent_black_pearl": 1,
        "reagent_mandrake_root": 1
      }
    },
    "cast_rounds": 0,
    "range_tiles": 6,
    "effects": [
      {
        "type": "damage",
        "element": "energy",
        "base": 6,
        "variance_pct": 0.15,
        "scaling": {
          "INT": 0.1
        }
      }
    ],
    "fizzle": {
      "base": 0.08,
      "magery_factor": -0.001
    },
    "resist_check": {
      "type": "resist_spells",
      "scale": 200
    },
    "ai_tags": [
      "nuke"
    ]
  },
  {
    "id": "minor_ward",
    "name": "Minor Ward",
    "school": "earth",
    "circle": 1,
    "cost": {
      "mana": 3,
      "reagents": {
        "reagent_bloodmoss": 1,
        "reagent_ginseng": 1
      }
    },
    "cast_rounds": 0,
    "range_tiles": 0,
    "effects": [
      {
        "type": "ward",
        "resists": {
          "fire": 3,
          "cold": 3,
          "poison": 3,
          "energy": 3
        },
        "rounds": 2,
        "scaling": {
          "magery": 0.02
        }
      }
    ],
    "fizzle": {
      "base": 0.08,
      "magery_factor": -0.001
    },
    "resist_check": null,
    "ai_tags": [
      "buff"
    ]
  },
  {
    "id": "minor_cure",
    "name": "Minor Cure",
    "school": "earth",
    "circle": 1,
    "cost": {
      "mana": 3,
      "reagents": {
        "reagent_garlic": 1,
        "reagent_ginseng": 1
      }
    },
    "cast_rounds": 0,
    "range_tiles": 0,
    "effects": [
      {
        "type": "cleanse",
        "remove": [
          "poison"
        ],
        "strength": "lesser"
      }
    ],
    "fizzle": {
      "base": 0.08,
      "magery_factor": -0.001
    },
    "resist_check": null,
    "ai_tags": [
      "utility",
      "heal"
    ]
  },
  {
    "id": "illuminate",
    "name": "Illuminate",
    "school": "energy",
    "circle": 1,
    "cost": {
      "mana": 2,
      "reagents": {
        "reagent_black_pearl": 1
      }
    },
    "cast_rounds": 0,
    "range_tiles": 0,
    "effects": [
      {
        "type": "light",
        "radius": 4,
        "rounds": 8
      }
    ],
    "fizzle": {
      "base": 0.08,
      "magery_factor": -0.001
    },
    "resist_check": null,
    "ai_tags": [
      "utility"
    ]
  },
  {
    "id": "fire_dart",
    "name": "Fire Dart",
    "school": "fire",
    "circle": 2,
    "cost": {
      "mana": 6,
      "reagents": {
        "reagent_black_pearl": 1,
        "reagent_sulfurous_ash": 1
      }
    },
    "cast_rounds": 0,
    "range_tiles": 6,
    "effects": [
      {
        "type": "damage",
        "element": "fire",
        "base": 9,
        "variance_pct": 0.15,
        "scaling": {
          "INT": 0.2
        }
      }
    ],
    "fizzle": {
      "base": 0.12,
      "magery_factor": -0.001
    },
    "resist_check": {
      "type": "resist_spells",
      "scale": 200
    },
    "ai_tags": [
      "nuke"
    ]
  },
  {
    "id": "ice_shards",
    "name": "Ice Shards",
    "school": "cold",
    "circle": 2,
    "cost": {
      "mana": 6,
      "reagents": {
        "reagent_black_pearl": 1,
        "reagent_spiders_silk": 1
      }
    },
    "cast_rounds": 0,
    "range_tiles": 5,
    "effects": [
      {
        "type": "damage",
        "element": "cold",
        "base": 8,
        "variance_pct": 0.15,
        "scaling": {
          "INT": 0.1
        }
      },
      {
        "type": "slow",
        "move_tiles_delta": -1,
        "rounds": 2
      }
    ],
    "fizzle": {
      "base": 0.12,
      "magery_factor": -0.001
    },
    "resist_check": {
      "type": "resist_spells",
      "scale": 200
    },
    "ai_tags": [
      "nuke",
      "control"
    ]
  },
  {
    "id": "venom_pin",
    "name": "Venom Pin",
    "school": "toxic",
    "circle": 2,
    "cost": {
      "mana": 5,
      "reagents": {
        "reagent_nightshade": 1,
        "reagent_garlic": 1
      }
    },
    "cast_rounds": 0,
    "range_tiles": 5,
    "effects": [
      {
        "type": "dot",
        "element": "poison",
        "base_per_round": 3,
        "variance_pct": 0.1,
        "rounds": 3,
        "scaling": {
          "INT": 0.1
        }
      }
    ],
    "fizzle": {
      "base": 0.12,
      "magery_factor": -0.001
    },
    "resist_check": {
      "type": "resist_spells",
      "scale": 200
    },
    "ai_tags": [
      "debuff",
      "dot"
    ]
  },
  {
    "id": "stone_skin",
    "name": "Stone Skin",
    "school": "earth",
    "circle": 2,
    "cost": {
      "mana": 5,
      "reagents": {
        "reagent_bloodmoss": 1,
        "reagent_ginseng": 1,
        "reagent_garlic": 1
      }
    },
    "cast_rounds": 1,
    "range_tiles": 0,
    "effects": [
      {
        "type": "ward",
        "resists": {
          "slash": 5,
          "pierce": 5,
          "blunt": 5
        },
        "rounds": 2,
        "scaling": {
          "magery": 0.02
        }
      }
    ],
    "fizzle": {
      "base": 0.12,
      "magery_factor": -0.001
    },
    "resist_check": null,
    "ai_tags": [
      "buff"
    ]
  },
  {
    "id": "mend",
    "name": "Mend",
    "school": "energy",
    "circle": 2,
    "cost": {
      "mana": 6,
      "reagents": {
        "reagent_ginseng": 1,
        "reagent_mandrake_root": 1
      }
    },
    "cast_rounds": 1,
    "range_tiles": 0,
    "effects": [
      {
        "type": "heal",
        "base": 9,
        "variance_pct": 0.15,
        "scaling": {
          "INT": 0.1
        }
      }
    ],
    "fizzle": {
      "base": 0.12,
      "magery_factor": -0.001
    },
    "resist_check": null,
    "ai_tags": [
      "heal"
    ]
  },
  {
    "id": "detect_magic",
    "name": "Detect Magic",
    "school": "energy",
    "circle": 2,
    "cost": {
      "mana": 3,
      "reagents": {
        "reagent_mandrake_root": 1,
        "reagent_black_pearl": 1
      }
    },
    "cast_rounds": 0,
    "range_tiles": 0,
    "effects": [
      {
        "type": "reveal",
        "radius_tiles": 6,
        "tags": [
          "trap",
          "secret",
          "magic"
        ],
        "rounds": 3
      }
    ],
    "fizzle": {
      "base": 0.12,
      "magery_factor": -0.001
    },
    "resist_check": null,
    "ai_tags": [
      "utility"
    ]
  },
  {
    "id": "fireball",
    "name": "Fireball",
    "school": "fire",
    "circle": 3,
    "cost": {
      "mana": 8,
      "reagents": {
        "reagent_black_pearl": 1,
        "reagent_sulfurous_ash": 1
      }
    },
    "cast_rounds": 1,
    "range_tiles": 5,
    "effects": [
      {
        "type": "damage",
        "element": "fire",
        "base": 14,
        "variance_pct": 0.15,
        "scaling": {
          "INT": 0.15,
          "magery": 0.04
        }
      }
    ],
    "fizzle": {
      "base": 0.15,
      "magery_factor": -0.001
    },
    "resist_check": {
      "type": "resist_spells",
      "scale": 200
    },
    "ai_tags": [
      "nuke"
    ]
  },
  {
    "id": "blink",
    "name": "Blink",
    "school": "energy",
    "circle": 3,
    "cost": {
      "mana": 7,
      "reagents": {
        "reagent_black_pearl": 1,
        "reagent_mandrake_root": 1
      }
    },
    "cast_rounds": 0,
    "range_tiles": 0,
    "effects": [
      {
        "type": "teleport",
        "tiles": 3
      }
    ],
    "fizzle": {
      "base": 0.15,
      "magery_factor": -0.001
    },
    "resist_check": null,
    "ai_tags": [
      "escape",
      "utility"
    ]
  },
  {
    "id": "arc_lance",
    "name": "Arc Lance",
    "school": "energy",
    "circle": 3,
    "cost": {
      "mana": 7,
      "reagents": {
        "reagent_black_pearl": 1,
        "reagent_mandrake_root": 1
      }
    },
    "cast_rounds": 1,
    "range_tiles": 6,
    "effects": [
      {
        "type": "damage",
        "element": "energy",
        "base": 12,
        "variance_pct": 0.15,
        "scaling": {
          "INT": 0.15,
          "magery": 0.04
        },
        "properties": {
          "pierce_shield": true
        }
      }
    ],
    "fizzle": {
      "base": 0.15,
      "magery_factor": -0.001
    },
    "resist_check": {
      "type": "resist_spells",
      "scale": 200
    },
    "ai_tags": [
      "nuke"
    ]
  },
  {
    "id": "earthen_grasp",
    "name": "Earthen Grasp",
    "school": "earth",
    "circle": 3,
    "cost": {
      "mana": 6,
      "reagents": {
        "reagent_bloodmoss": 1,
        "reagent_spiders_silk": 1
      }
    },
    "cast_rounds": 1,
    "range_tiles": 5,